{"schema_version":"1.0","legal_hold_receipt_id":"LS-LEGAL-HOLD-APPLY-001","hold_id":"HOLD-001","archive_receipt_ref":"ARCHIVE-001","archive_manifest_sha256":"aaaaaaaaaaaaaaaaaaaaaaaaaaaaaaaaaaaaaaaaaaaaaaaaaaaaaaaaaaaaaaaa","sku_id":"SKU-1","passport_id":"PSP-OLD","action":"APPLY","actor_id":"LEGAL-1","actor_authority":"LEGAL_OWNER","reason":"active investigation","acted_at":"2026-10-04T12:00:00Z","previous_receipt_ref":null,"status":"LEGAL_HOLD_ACTIVE"}
