{"schema_version":"1.0","legal_hold_receipt_id":"LS-LEGAL-HOLD-RELEASE-001","hold_id":"HOLD-001","archive_receipt_ref":"ARCHIVE-001","archive_manifest_sha256":"aaaaaaaaaaaaaaaaaaaaaaaaaaaaaaaaaaaaaaaaaaaaaaaaaaaaaaaaaaaaaaaa","sku_id":"SKU-1","passport_id":"PSP-OLD","action":"RELEASE","actor_id":"ADMIN-1","actor_authority":"PASSPORT_ADMIN","reason":"investigation closed","acted_at":"2026-10-05T12:00:00Z","previous_receipt_ref":"LS-LEGAL-HOLD-APPLY-001","status":"LEGAL_HOLD_RELEASED"}
